,Name,Duration,Genre,Rating,No. of Ratings,No. of Episodes,Creators,Stars,Reviews (Users),Reviews (Critics),Seasons,Storyline,Language,Release Date
187,Qubool Hai 2.0,23min,['Romance'],8.6,874,10,,"['Daksh Sharma', 'Lillete Dubey', 'Karan Singh Grover']",87,2,1,"It is the story of Asad and Zoya -- two individuals who have surrendered to their ideals. One to the cause of his country, another to her duty towards her family.",Hindi,12 March 2021 (India)
188,Bhram,22min,['Horror'],6.5,312,8,,"['Kalki Koechlin', 'Jashn Agnihotri', 'Aashit Chatterjee']",18,,1,"A car accident turns Alisha Khanna's life upside down. The bestselling romance writer moves to Shimla to her sister's place in order to start over. However, she starts getting visions of a girl. At first, she dismisses it as hallucinations due to her PTSD. However, she finds out that the girl had died 20 years ago. On the pretext of writing a book, she starts investigating into the matter and finds striking evidence which otherwise could never be found. Things point to certain prominent people of the place, but then they end up dying one by one. Alisha doesn't know that she has put her own life in danger. How far will one woman go to give justice to a dead girl? The answer lies in that incident which happened 20 years ago. The incident which shall tell the world - The Other Side of Her story.
Written by
Mrugesh",Hindi,18 September 2019 (India)
189,Punyashlok Ahilyabai,30min,"['Drama', 'History']",7.1,263,1,,"['Krish Chauhan', 'Harsh Joshi', 'Sukhada Khandkekar']",37,,1,"Ahilya decides to build her own temple after an argument with the pandit. On the other hand, Malhar Rao is concerned about his son Khande Rao's laid-back attitude.",Hindi,4 January 2021 (India)
190,Hundred,30min,"['Comedy', 'Drama']",6.8,722,8,,"['Lara Dutta', 'Rinku Rajguru', 'Karan Wahi']",46,3,1,An unapologetic and frustrated ACP teams up with an honest civil worker who teams up to accomplish their personal objectives.,Hindi,24 April 2020 (India)
191,The Verdict - State Vs Nanavati,20min,['Crime'],7.6,850,10,,"['Manav Kaul', 'Elli Avrram', 'Angad Bedi']",628,,1,"Kawas Manekshaw Nanavati returns from his ship and comes to know that his wife Silvia is in relationship with his friend Prem Ahuja.Kawas in a fit of range goes to meet Prem and and fires three rounds leaving him dead and surrenders himself to Inspector John Lobo.When the story leaks out Blitz a popular newspaper plays a major part in covering it while the Navy and Parsi community are with Kawas and he has a top lawyer Karl Khandalawala representing him but he pleads himself guilty.On the other hand Prem's sister Meme isn't concerned with prosecution lawyer Chandru Trivedi who has got his big case for first time and wants a top lawyer Ram Jethmalani.In the history of India this was the only case where Jury members were appointed to give their opinion.
Written by
alex.mjacko@gmail.com",Hindi,30 September 2019 (India)
192,Kahiin To Hoga,24min,['Drama'],4.8,209,799,['Ekta Kapoor'],"['Aamna Sharif', 'Rajeev Khandelwal', 'Rohit Bakshi']",,,1,"The about is Kashish and her four sisters. Sujal is a handsome boy, meets Kashish and introduces her to his sisters. Later they find out that Sujal is the person whom they left behind when she crashed her car. This is the beginning of a serious misunderstanding between Sujal and Kashish. Slowly Sujal and Kashish start a loving relationship, but Kashish's life seems to face continual problems with Sujal.
Written by
sunillkumarsoni",Hindi,8 September 2003 (India)
193,The Aam Aadmi Family,,"['Comedy', 'Drama']",8.5,1809,20,,"['Gunjan Malhotra', 'Brijendra Kala', 'Lubna Salim']",15,,4,"This show revolves around a middle-class Sharma family. There's a gossip-loving grandmother, a hardworking father, a sanskaari mom, and two grown up kids who are dealing with their middle-classness in the best way possible.",Hindi,5 November 2016 (India)
194,Yeh Un Dinon Ki Baat Hai,20min,"['Drama', 'Romance']",8.6,1601,497,,"['Randeep Rai', 'Ashi Singh', 'Ayesha Kaduskar']",45,,1,The story chronicles the adolescent romance between Naina and Sameer and explores the magic of 'first love' set in the city of Ahmedabad in the year 1990.,Hindi,5 September 2017 (India)
195,Legends of Chima,22min,"['Animation', 'Action', 'Adventure']",5.8,542,42,"['Tommy Andreasen', 'John Derevlany', 'Erik Legernes', '1 more credit']","['David Attar', 'Bethany Brown', 'Bill Courage']",14,1,3,"The magical world of CHIMA - a land ruled by animals that walk, talk, drive vehicles, use machinery and live in castles - was once a pristine, natural paradise but has now become a battle ground where friends have become worst enemies.",English,January 2013 (USA)
196,1232 KMS,1h 26min,['Documentary'],8.2,433,0,,,58,2,,"Weeks after the nationwide COVID-19 lockdown, seven migrant labourers, on the verge of starvation, decided to go to their village just like millions of others.",Hindi,24 March 2021 (India)
197,Bhaag Beanie Bhaag,29min,['Comedy'],3.8,3609,6,"['Ravi Patel', 'Neel Shah']","['Swara Bhaskar', 'Ravi Patel', 'Varun Thakur']",311,6,1,"Beanie has always done what's asked of her -- until she decides to run from her very comfortable life and pursue a career in stand-up comedy. As she navigates the demands of everyone from her concerned parents to her proposal-popping boyfriend, this is Beanie's journey to carve out the life she wants for herself amidst the chaos.",,4 December 2020 (USA)
198,The Big Day,40min,"['Reality-TV', 'Romance']",4.6,282,6,,"['Daniel Bauer', 'Prerna Gupta', 'Sanjeet Raman']",19,4,2,"For six engaged couples, happily ever after begins on a spectacular note in this eye-popping look at India’s multibillion-dollar wedding industry.",,14 February 2021 (USA)
199,Karenjit Kaur - The Untold Story of Sunny Leone,25min,"['Biography', 'Drama']",7.4,2648,20,,"['Bijay Anand', 'Raj Arjun', 'Karamvir Lamba']",29,4,3,"Karenjit Kaur - Sunny Leone ki Ankahi Dastaan is a ZEE5 Hindi Original. The web series stars Sunny Leone, Raj Arjun, Rysa Saujani, Karamvir Lamba, Bijay Jasjit Anand, Grusha Kapoor, Vansh Pradhan and Marc Buckner. The biopic narrates the sensational journey of India's Most Googled celebrity star from her girl next-door image as Karenjit Kaur to the hot Sunny Leone whose videos, songs and photos made an entire generation go crazy about her. Directed by Aditya Datt, this sensational drama reveals about her history, family, boyfriend turned husband Daniel Weber and traces her transformation from an adult film star to a popular Bollywood mainstream actress.
Written by
Raj Ravindra Rathod",English,16 July 2018 (India)
200,Lolita PG House Part 1,,"['Drama', 'Romance']",7.6,10,1,,"['Shahbaaz Khan', 'Abha Paul', 'Nimai Bali']",,,1,"Lolita is a lonely woman, whose husband has left her and she has to start a PG to pay Bank EMI and loans. But doing business is not easy for a single woman. To succeed, Lolita uses her attractive looks and curvy figure to seduce all those who come to trouble her.",Hindi,13 March 2021 (India)
201,Vaat Vaat Ma,18min,['Romance'],8.1,109,2,,"['Chirag Bhatt', 'Satish Bhatt', 'Chetan Daiya']",8,,1,Vaat Vaat Ma is a romantic tragedy where lovebirds Pahel and Swayam want to get divorced as soon as possible and they hire a divorce lawyer. The story takes a twist when the lawyer comes to the couple's place to get the signatures and then a nationwide lock down is announced.,Gujarati,30 April 2021 (India)
202,Kumkum Bhagya,20min,"['Comedy', 'Drama', 'Romance']",3.5,1117,1782,['Ekta Kapoor'],"['Sriti Jha', 'Shabbir Ahluwalia', 'Vin Rana']",33,5,1,"The story is about Pragya Arora, a humble teacher, and a rock star Abhishek Mehra. Sarla Arora runs a marriage hall and lives with the hope of seeing her two daughters happily married. Pragya, the elder daughter, is practical, hardworking and teaches at a college. Bulbul, the younger daughter, is outgoing and has her head in the clouds. The show follows the lives of the two sisters and their hopes, dreams, and aspirations.",Hindi,15 April 2014 (India)
203,Hai Taubba,,['Drama'],3.8,30,8,,"['Kirandeep Kaur', 'Gauri Batra', 'Nishank Verma']",,,2,"Hai Taubba is a compilation of 4 mature stories, representing emotions symbolized by a distinct colour of love.",Hindi,6 May 2021 (India)
204,Ramayan,45min,"['Adventure', 'Drama', 'Fantasy']",7.5,268,300,,"['Gurmeet Choudhary', 'Debina Bonnerjee', 'Ankit Arora']",4,,1,"The story follows the fortunes of Rama, the Prince of Ayodhya, who is sent on exile by the machinations of his step-mother Kaikeyi and her manipulative maid, Mantara. He is accompanied on his fourteen year exile by his wife, Sita and his brother, Lakshmana. Rama, Sita and Lakshmana spend their years in exile in beautiful surroundings and are often accompanied by Rishis and other wise men. However, the last year changes that idyllic experience. The Rakshasa Ravana, who rules Lanka, kidnaps Sita after he is enamoured by her beauty. Rama and Lakshmana set off in search of her and assemble an army of monkeys to invade Lanka and rescue Sita.",Hindi,2008 (India)
205,Chhota Bheem,15min,"['Animation', 'Action', 'Adventure']",4.3,623,632,,"['Mausam', 'Rajesh Kava', 'Kaustav Ghosh']",26,,12,"The extremely strong Bheem lives in a fictional town called Dholakpur set in rural India. The series revolves around Bheem, a nine-year-old boy, who is brave, strong and intelligent.Bheem's rival is Kalia Pahelwan, a jealous ten -year-old bully, who is envious of Bheem's popularity. Kalia, along with his sidekicks Dholu and Bholu, always plot to embarrass and defeat Bheem but never succeed. The story revolves around Bheem and his friends and their rivalry with Kalia and his friends. All the children of Dholakpur look up to Bheem, as he solves everyone's problems. He is also seen defeating some enemies in and around Dholakpur like the evil demon Kirmada, Kichak & Mangal Singh. Bheem earns the trust of Dholakpur and Raja Indravarma.The stories of Bheem project him as a hero of Dholakpur.He saves Dholakpur and the world by having a laddoo with a cocktail of courage and gravity defying stunts.
Written by
Swarup Basak",Hindi,2008 (India)
206,Shaurya Aur Anokhi Ki Kahaani,,['Drama'],9.2,3517,4,,"['Debattama Saha', 'Karanvir Sharma', 'Khalid Siddiqui']",553,,1,"Sparks fly when masked modern-day misogynist Shaurya comes across Anokhi, a headstrong girl. With their clashing ideologies on the line, will opposites attract?",Hindi,21 December 2020 (India)
207,Khwabon Ke Parindey,,['Drama'],7.8,25,2,,"['Oz Malik', 'Tushar Sharma', 'Mrinal Dutt']",4,,1,,Hindi,14 June 2021 (India)
208,Shrikant Bashir,33min,['Action'],7.2,703,27,,"['Priya Chauhan', 'Ashmita Jaggi', 'Imran Javed']",79,,1,"SHRIKANT BASHIR is an edgy action drama series which showcases the partnership of two ideologically and ethnically different individuals working for Surgical Operation Team (SOT), a premium intelligence agency that solves crimes of national threat. The series is led by the dynamic duo Shrikant Mhatre and Bashir Khan, who cannot see eye to eye, but end up working together - bending their personal differences - for the greater good of the nation. The SOT faces a constant threat by a terrorist groups and international criminals who cause tumultuous events such as Nuclear Threats, Bank Scams, a Biological warfare that lead the SOT to perform Surgical Operations.",Hindi,11 December 2020 (India)
209,Feluda Pherot,,['Mystery'],8.2,985,7,,"['Tota Roy Chowdhury', 'Anirban Chakrabarti', 'Kalpan Mitra']",50,2,1,Chronicles the adventures of Prodosh Chandra Mitra a Bengali private detective along with his sidekick Topshe and friend Lalmohan Ganguly,Bengali,25 December 2020 (India)
210,Smoke,40min,['Thriller'],8.4,4533,11,,"['Jim Sarbh', 'Kalki Koechlin', 'Mandira Bedi']",1028,2,1,"Set in Goa, Smoke explores the dark web of drugs, mafia, and power. With the cartels at war, who will survive?",Hindi,26 October 2018 (India)
211,Your Honour,,['Drama'],8.6,21,0,,"['Kavita Chaudhary', 'Manoj Joshi', 'Sachin Khedekar']",,,,,Hindi,March 2000 (India)
212,Dil Se Dil Tak,20min,['Drama'],8,345,346,,"['Rohan Gandotra', 'Rashami Desai', 'Jasmin Bhasin']",1,1,1,"Parth and Shorvori decide to get married, despite stiff opposition from their families. However, destiny has other plans for them as they cross paths with Teni.",Hindi,2017 (India)
213,Malgudi Days,,['Drama'],9.5,3515,54,,"['Master Manjunath', 'Girish Karnad', 'Vaishali Kasaravalli']",24,,1,"Malgudi - a fictitious small town in south India is typical of any small town or village, habituated by timeless characters who could be living anywhere in the world. They are simple folk, dealing with lives in a uniquely engaging, humorous and humane manner. Famous Indian novelist R.K.Narayan, drew on his observance of human life to create the magic of Malgudi Days. Directed by the late Kannada actor and director, Shankar Nag in 1987, the famous television series was shot entirely near Agumbe in Shimoga District, Karnataka. The sketches for the serial were done by Narayan's brother and acclaimed cartoonist, R.K.Laxman.",Hindi,18 March 1987 (India)
214,Sandwiched Forever,30min,['Comedy'],8.6,596,16,,"['Kunaal Roy Kapur', 'Aahana Kumra', 'Atul Kulkarni']",58,,1,"The newly married couple, Sameer and Naina's life spins out of control, as both their parents move in as their next-door neighbours, and as a result, they get Sandwiched Forever.",Hindi,25 December 2020 (India)
215,Geet,22min,['Romance'],6.6,315,470,,"['Gurmeet Choudhary', 'Drashti Dhami', 'Piyush Sahdev']",2,1,1,The story revolves around a small town Woman Geet and how she tackles all the difficulties that come in her way with an unconditional support from a business tycoon Maan Singh Khurana.,Hindi,5 April 2010 (India)
216,Santoshi Maa,20min,['Drama'],4.8,12,499,['Rashmi Sharma'],"['Ayaz Ahmed', 'Debina Bonnerjee', 'Ratan Rajput']",1,,1,"Santoshi Maa is the story of Santoshi, a loving girl with a heart of gold who has been a worshiper of the Goddess since childhood. Much like the Goddess of santosh or contentment, Santoshi has no malice or greed in her heart and believes in respecting every individual. The show will chart her journey and how her unfaltering faith in the Goddess bails her out of the most difficult situations.",Sanskrit,2015 (India)
217,64 Zoo Lane,11min,"['Animation', 'Family']",6.5,632,104,['An Vrombaut'],"['Adrienne Posta', 'Keith Wickham', 'Bob Saker']",2,,4,"64 Zoo Lane is a kid show about a girl who goes outside her house at night to play with her zoo friends including a giraffe, zebra and more. The show is definitely a show for the whole family to watch.",French,18 February 1999 (France)
218,Jijaji Chhat Parr Koii Hai,,"['Comedy', 'Horror']",7.2,223,2,,"['Sumit Arora', 'Raashi Bawa', 'Vipin Heero']",20,,1,"The show is sequel of previous successful show, Jijaji Chhat Par Hai., & is a comedy cum horror story where 2 families will be fighting to get a Haveli (a Mansion) but these both families are unaware of ghost existence in that mansion.",Hindi,8 March 2021 (India)
219,Yeh Hai Mohabbatein,20min,['Drama'],4.5,855,1868,,"['Divyanka Tripathi Dahiya', 'Karan Patel', 'Ruhanika Dhawan']",14,2,1,"Ye Hai Mohabbatein, based on a novel Custody by Manju Kapoor, showcases divorce, infertility, remarriage, mature love and deals with societal issues. It follows the story of Raman and Ishita who are connected by their common love for Raman's little daughter Ruhi. Ishita is a Tamilian whereas Raman is a Punjabi.
Written by
Star Plus",Hindi,3 December 2013 (India)
220,Shootout at Alair,38min,['Action'],6.1,74,8,,"['Snigdha Bawa', 'Prakash Raj', 'Meka Srikanth']",13,,1,"Akhtar kills a policeman every year on the day of the Mecca Masjid blasts. Soon, Akhtar is encountered. However, after several years, when a policeman gets killed on the same day, IG Praveen Chand suspects Akhtar's involvement. Is Akhtar still alive.",Telugu,25 December 2020 (India)
221,Dude,32min,"['Drama', 'Mystery', 'Thriller']",9.3,1661,5,,"['Ambrish Verma', 'Arun Kushwah', 'Apoorva Arora']",97,,1,"Dude depicts the life of a detective, scrambling to hunt down the answers behind a baffling case. It reels him into twisted relationships filled with perplexing events. And the more he tries to untangle the truth, the more convoluted it becomes.",Hindi,27 February 2021 (India)
222,Home,,['Drama'],8.2,205,12,,"['Amol Parashar', 'Annu Kapoor', 'Supriya Pilgaonkar']",7,3,1,"The Sethis are a typical next-door, middle-class family. They hold on to their values and find happiness in little things. They make do with limited resources, but their love for each other reflects in their eyes. Their home is their biggest and proudest possession. But their world comes crashing down when they are served an eviction notice by the authorities. What will they do to save their home? Will they succeed in saving their home or will their attempts go in vain? Watch Home, a story of a common man's fight for his shelter.",Hindi,29 August 2018 (India)
223,XYX,,['Drama'],8.6,13,5,,"['Tarun Gahlot', 'Richa Gupta', 'Neha Iyer']",,,1,"Nikky, Farah, Binny- Three Friends, flatmates, and colleagues. The confusion starts when a question arises about who loves whom? Will they be able to straighten out their friendship or the love triangle that is twisted in all means.",Telugu,2019 (India)
224,Honeymoon,,['Romance'],8.7,39,0,,"['Sanjana Anand', 'Apoorva Bharadwaj', 'Archana Kottige']",1,,,"After consenting to an arranged marriage, Praveen and Tejaswini embark on a journey filled with unexpected events and galore of emotions, and their unplanned honeymoon turns out to be the best decision ever.",Telugu,27 November 2020 (India)
225,Mohor,22min,['Drama'],6.6,49,380,,"['Sonamoni Saha', 'Pratik Sen', 'Prodyot Mukherjee']",5,,1,"Mohor is an undergraduate student, who aspires to be a teacher. When her father forces her to get married, Mohor embarks upon an extraordinary journey to pursue her dreams.",Bengali,2019 (India)
226,Meri Aashiqui Tum Se Hi,20min,['Drama'],,,446,,"['Shakti Arora', 'Radhika Madan', 'Shahab Khan']",6,2,1,"Ranvir come to Mumbai with his father at age of 9 .The first time he saw Ishaani,he fell in love with her.however,he had to face a lot of trouble to confess his love to her.",,
227,Mahabharat Katha,45min,"['Family', 'Fantasy']",8.9,61,45,,"['Harish Bhimani', 'Rishabh Shukla', 'Arjun']",,,1,"This series covers events not included in Mahabharat (1988). Life of Gatotkatcha and his marriage to Maurvi, Krishna killing Narkasur and marrying 16000 of unmarried women held captive, Hidimbaa, birth and role of Barbareek, aftermath of the war, Arjuna's various royal friendship marriages on tour of repentence, Ashwamedha Yagna, mourning after war, etc. Also covered are psychological sufferings of war survivors, reunion of Kuru-Pandav families that broke down in war, back stories of Karna's marriage to Padmavati, Arjuna's marriages to Uloopi and Chitrangada, acceptance of Karna as family member by all after his death, Arjun and Chitrangada's son Babruvahan's quest to defeat his own father. The series ran for 45 episodes but was a failure cutting short a lot more events in the Mahabharat. It mostly featured the time period from the Rajasuya Yagna to Arjuna's death and his resurrection at the hands of Babruvahan.
Written by
Vikas Bhatt",Hindi,1997 (India)
228,Singa Penne,,"['Drama', 'Romance']",7.3,43,25,,"['Shyam Prasad', 'Payal Radhakrishna', 'Arnav']",8,,1,"Arnav, Payal, Uday, and Kutti Padmini in the lead roles. The story revolves around Mahalakshmi, an independent village girl, who decides to break the stereotype and train herself for the Border Security Force. What's Mahalakshmi's motive behind joining the security force and can she find success in her breakthrough journey?",Tamil,22 December 2020 (India)
229,Everest,25min,"['Adventure', 'Drama']",7.6,176,102,,"['Shamata Anchan', 'Sahil Salathia', 'Rohan Gandotra']",5,,5,"A young girl aspires to conquer her own personal Everest - of getting her father's love and respect. At the age of 21, she is faced with the biggest conflict of her life and is forced to question her very own existence. To redeem herself and find a place in her father's heart she decides to fulfill her father's unfulfilled dream - to summit the greatest and highest of all mountains, Mt Everest.
Written by
Star Plus",Hindi,3 November 2014 (India)
230,Dil Dosti Dance,,"['Drama', 'Romance']",8.5,67,859,,"['Shakti Mohan', 'Shantanu Maheshwari', 'Vrushika Mehta']",5,,1,"A dance-based show that traces the journey of a college students and their passion for dance, as they wade through emotions around love and friendship.",Hindi,2011 (India)
231,Kkusum,20min,"['Drama', 'Family']",4.3,67,1001,['Ekta Kapoor'],"['Tasneem Sheikh', 'Rupa Divetia', 'Raymon Singh']",2,1,1,"Kkusum is the story of a woman whose upbringing has instilled strong middle class values in her and has taught her to be strong willed, self respecting and at the same time loving and caring.",Hindi,14 May 2001 (India)
232,Dangerous,19min,['Thriller'],2.9,335,8,,"['Rajdeep Choudhury', 'Nitin Arora', 'Bipasha Basu']",36,2,1,"Revolves around the life of Aditya Dhanraj (Karan Singh Grover), a young struggling entrepreneur, who discovers that his wife Diya Dhanraj (Sonali Raut) has gone missing. He sets out to find his wife with the help of the police, only to discover that his ex-girlfriend Neha Singh (Bipasha Basu) will be handling his case. In pursuit of the truth, will they dig into many 'dangerous' hidden secrets like murder, kidnapping or even a case of business rivalry? Or is there something more to the case than meets the eye?",Hindi,14 August 2020 (India)
233,Shaktimaan,1h,"['Action', 'Adventure', 'Family']",8.2,4315,520,,"['Mukesh Khanna', 'Vaishnavi Mahant', 'Surendra Pal']",15,2,1,"When evil was ruling the world, the Suryanshis chose an ordinary man as the warrior to fight evil. When the five natural elements of life, fire, earth, water, wind and sky invigorated his body, he gained superpowers from these elements. Eventually he transformed into Shaktimaan. Shaktimaan was the rebirth of Shri Satya who had formed the Suryanshi Sect after the war of the Mahabharata 7,500 years ago. He got his powers from 7 spiritual gurus who had blessed him with mystical yogic shakti and trained him in ancient combat forms. During his training, Shaktimaan was taught the way to energize the 7 chakras of body through Kundalini Yoga that helped him get mystical and supernatural powers. He also conducted the ritual of death in order to get total control over his powers. This process, instead of killing him, made him almost immortal and stronger than any mere human being. Towards the end the Suryanshis performed a Yagya (Yajna) through which he entered holy fire and immersed his ...
Written by
Swarup Basak",Hindi,14 September 1997 (India)
234,Pavitra Rishta,24min,"['Drama', 'Romance']",7.2,1451,1324,['Ekta Kapoor'],"['Ankita Lokhande', 'Amit Sarin', 'Sushant Singh Rajput']",12,1,1,"Story of Archana, whose sole objective is to fulfill the needs of her family and keep everyone happy. How she meets her soul mate Manav, gets married to him and how they deal with twists and turns of life.",Hindi,2009 (India)
235,Yeh Hai Aashiqui,,['Romance'],7.2,84,153,,"['Anita Hassanandani Reddy', 'Vikrant Massey', 'Niti Taylor']",,,4,Yeh Hai Aashiqui is an Indian television series that presents dramatizations of love stories. It airs on Bindass channel started on 25 August 2013.,Hindi,2013 (India)
236,Medically Yourrs,,['Drama'],7.3,603,10,,"['Shantanu Maheshwari', 'Radhey Lotwala', 'Priyanka Arya']",685,,1,"ALTBalaji's Medically Yourrs revives crazy college-time nostalgia with its quirky narrative, which is spun around the struggles of MBBS students. Stuck between their dreams and a degree, these students desperately seek balance amidst the educational and emotional rollercoaster ride at KIMS.",Hindi,2019 (India)
237,Chand Chupa Badal Mein,20min,"['Drama', 'Romance']",7.5,11,722,,"['Neha Sargam', 'Abhishek Tiwari', 'Kinshuk Mahajan']",,,1,"Set in the beautiful hill town of Simla, Chaand Chupa Badal Mein narrates the tale of a middle-class girl Nivedita Sharma a.k.a. Nivi a.k.a Putul. She is kind, sweet, responsible, but also nervous and reserved. She lost her mother when she was a little girl. Since then, she has been living with her grandmother, father and younger brother. Nivedita meets her childhood friend Siddharth Sood after many years and the two fall in love with each other. But on discovering that her cousin Divya also loves Siddharth, Nivi unhesitatingly sacrifices her own love by pretending that she is indifferent to him. Under pressure from his family, and hurt by Nivi's rejection, Siddharth gets married to Divya. Nivi ends up marrying Siddharth's cousin Viren. Later, it is revealed that Viren has married Nivi to take revenge against Siddharth and his family. However, gradually both Nivi and Viren start caring for each other. When Nivi discovers Viren's real intentions she transforms him and brings him closer...",Hindi,2010 (India)
238,Hey Prabhu!,22min,"['Comedy', 'Romance']",8.7,2451,16,,"['Rajat Barmecha', 'Rituraj Singh', 'Parul Gulati']",127,1,2,"A boy in his early 20s, who has a strong Twitter and Snapchat following, realises that online cred isn't enough to overcome real-life situations. To top it off, his personal life is at an all-time low, because he has started experiencing sexual problems at 24.
Written by
MX Play",Hindi,20 February 2019 (India)
239,Haq Se,25min,['Drama'],8.3,528,20,,"['Rajeev Khandelwal', 'Surveen Chawla', 'Parul Gulati']",12,1,1,"Four blood-bound sisters with four passionate dreams, all yearning for one thing: fulfilment. This is a modern-day story of dreams, desires, love, war and the eternal pursuit of happiness, set against the breathtaking beauty and unsettling unrest of Kashmir.",Hindi,2 February 2018 (India)
